<?xml version="1.0" encoding="UTF-8"?>
<xsd:schema xmlns:xsd="http://www.w3.org/2001/XMLSchema" xmlns:od="urn:schemas-microsoft-com:officedata">
<xsd:element name="dataroot">
<xsd:complexType>
<xsd:sequence>
<xsd:element ref="cobros_banco" minOccurs="0" maxOccurs="unbounded"/>
</xsd:sequence>
<xsd:attribute name="generated" type="xsd:dateTime"/>
</xsd:complexType>
</xsd:element>
<xsd:element name="cobros_banco">
<xsd:annotation>
<xsd:appinfo>
<od:index index-name="PrimaryKey" index-key="Idcobros_banco " primary="yes" unique="yes" clustered="no" order="asc"/>
<od:tableProperty name="PublishToWeb" type="2" value="1"/>
<od:tableProperty name="GUID" type="9" value="5WQSDHNMQkiG7FyYrJez4Q==
"/>
<od:tableProperty name="Orientation" type="2" value="0"/>
<od:tableProperty name="OrderByOn" type="1" value="0"/>
<od:tableProperty name="NameMap" type="11" value="CswOVQAAAADlZBIMc0xCSIbsXJisl7PhAAAAAPDloXC3Z+ZAAAAAAAAAAABjAG8A
YgByAG8AcwBfAGIAYQBuAGMAbwAAAAAAAACY/Ajrp/trSYwILW5kTbGeBwAAAOVk
EgxzTEJIhuxcmKyXs+FJAGQAYwBvAGIAcgBvAHMAXwBiAGEAbgBjAG8AAAAAAAAA
gbWLF9FbCEWzCDR8wh0x/gcAAADlZBIMc0xCSIbsXJisl7PhaQBkAGMAbwBiAHIA
bwAAAAAAAAApYBTbTHIMQ6Dg39RbE+EOBwAAAOVkEgxzTEJIhuxcmKyXs+FpAGQA
YwB1AGUAbgB0AGEAAAAAAAAAAAAAAAAAAAAAAAAAAAAAAAwAAAAFAAAAAAAAAAAA
AAAAAAAAAAA=
"/>
<od:tableProperty name="DefaultView" type="2" value="2"/>
<od:tableProperty name="DisplayViewsOnSharePointSite" type="2" value="1"/>
<od:tableProperty name="TotalsRow" type="1" value="0"/>
<od:tableProperty name="FilterOnLoad" type="1" value="0"/>
<od:tableProperty name="OrderByOnLoad" type="1" value="1"/>
<od:tableProperty name="HideNewField" type="1" value="0"/>
<od:tableProperty name="BackTint" type="6" value="100"/>
<od:tableProperty name="BackShade" type="6" value="100"/>
<od:tableProperty name="ThemeFontIndex" type="4" value="1"/>
<od:tableProperty name="AlternateBackThemeColorIndex" type="4" value="1"/>
<od:tableProperty name="AlternateBackTint" type="6" value="100"/>
<od:tableProperty name="AlternateBackShade" type="6" value="95"/>
<od:tableProperty name="ReadOnlyWhenDisconnected" type="1" value="0"/>
<od:tableProperty name="DatasheetGridlinesThemeColorIndex" type="4" value="3"/>
<od:tableProperty name="DatasheetForeThemeColorIndex" type="4" value="0"/>
</xsd:appinfo>
</xsd:annotation>
<xsd:complexType>
<xsd:sequence>
<xsd:element name="Idcobros_banco" minOccurs="1" od:jetType="autonumber" od:sqlSType="int" od:autoUnique="yes" od:nonNullable="yes" type="xsd:int">
<xsd:annotation>
<xsd:appinfo>
<od:fieldProperty name="GUID" type="9" value="mPwI66f7a0mMCC1uZE2xng==
"/>
<od:fieldProperty name="ColumnWidth" type="3" value="3276"/>
<od:fieldProperty name="ColumnOrder" type="3" value="1"/>
<od:fieldProperty name="ColumnHidden" type="1" value="0"/>
<od:fieldProperty name="TextAlign" type="2" value="0"/>
<od:fieldProperty name="AggregateType" type="4" value="-1"/>
<od:fieldProperty name="ResultType" type="2" value="0"/>
<od:fieldProperty name="CurrencyLCID" type="4" value="0"/>
</xsd:appinfo>
</xsd:annotation>
</xsd:element>
<xsd:element name="idcobro" minOccurs="0" od:jetType="longinteger" od:sqlSType="int" type="xsd:int">
<xsd:annotation>
<xsd:appinfo>
<od:fieldProperty name="GUID" type="9" value="gbWLF9FbCEWzCDR8wh0x/g==
"/>
<od:fieldProperty name="ColumnWidth" type="3" value="-1"/>
<od:fieldProperty name="ColumnOrder" type="3" value="0"/>
<od:fieldProperty name="ColumnHidden" type="1" value="0"/>
<od:fieldProperty name="DecimalPlaces" type="2" value="255"/>
<od:fieldProperty name="DefaultValue" type="12" value="0"/>
<od:fieldProperty name="Required" type="1" value="0"/>
<od:fieldProperty name="DisplayControl" type="3" value="109"/>
<od:fieldProperty name="TextAlign" type="2" value="0"/>
<od:fieldProperty name="AggregateType" type="4" value="-1"/>
<od:fieldProperty name="ResultType" type="2" value="0"/>
<od:fieldProperty name="CurrencyLCID" type="4" value="0"/>
</xsd:appinfo>
</xsd:annotation>
</xsd:element>
<xsd:element name="idcuenta" minOccurs="0" od:jetType="longinteger" od:sqlSType="int" type="xsd:int">
<xsd:annotation>
<xsd:appinfo>
<od:fieldProperty name="GUID" type="9" value="KWAU20xyDEOg4N/UWxPhDg==
"/>
<od:fieldProperty name="ColumnWidth" type="3" value="-1"/>
<od:fieldProperty name="ColumnOrder" type="3" value="0"/>
<od:fieldProperty name="ColumnHidden" type="1" value="0"/>
<od:fieldProperty name="DecimalPlaces" type="2" value="255"/>
<od:fieldProperty name="DefaultValue" type="12" value="0"/>
<od:fieldProperty name="Required" type="1" value="0"/>
<od:fieldProperty name="DisplayControl" type="3" value="109"/>
<od:fieldProperty name="TextAlign" type="2" value="0"/>
<od:fieldProperty name="AggregateType" type="4" value="-1"/>
<od:fieldProperty name="ResultType" type="2" value="0"/>
<od:fieldProperty name="CurrencyLCID" type="4" value="0"/>
</xsd:appinfo>
</xsd:annotation>
</xsd:element>
</xsd:sequence>
</xsd:complexType>
</xsd:element>
</xsd:schema>
